oripathologie;commentaire;auteur;fr;cn;ar;th;ro;pl;pt;ja;it;es;de;en;
# commentaires.csv V1.0.1 - 26/12/2025 13:46:08;;;;;;;;;;;;;;;
activateur;L'activateur stimule la croissance mandibulaire, idéal pour les classes II.;gpt4o;L'activateur stimule la croissance mandibulaire, idéal pour les classes II.;激活器可刺激下颌骨生长，是 II 类患者的理想选择。;يحفز المنشط نمو الفك السفلي، وهو مثالي لمرضى الفئة الثانية.;ตัวกระตุ้นช่วยกระตุ้นการเจริญเติบโตของขากรรไกรล่าง เหมาะสำหรับกรณี Class II;Activatorul stimulează creșterea mandibulară, ideal pentru pacienții din clasa II.;Aktywator stymuluje wzrost żuchwy, idealny dla pacjentów klasy II.;O ativador estimula o crescimento mandibular, ideal para pacientes de Classe II.;アクチベーターは下顎の成長を促し、クラスⅡの患者に理想的です。;L'attivatore stimola la crescita mandibolare, ideale per i pazienti di Classe II.;El activador estimula el crecimiento mandibular, ideal para pacientes de Clase II.;Der Aktivator regt das Unterkieferwachstum an, ideal für Klasse II.;The activator stimulates mandibular growth, ideal for Class II patients.;
agénésie;Considérer une solution prothétique ou orthodontique pour compenser l'absence dentaire.;gpt4o;Considérer une solution prothétique ou orthodontique pour compenser l'absence dentaire.;考虑采用修复或正畸方案来弥补牙齿缺失。;فكر في حل تعويضي أو تقويمي لتعويض الأسنان المفقودة.;พิจารณาทางเลือกในการใช้ฟันปลอมหรือการจัดฟันเพื่อชดเชยฟันที่หายไป;Luați în considerare o soluție protetică sau ortodontică pentru a compensa lipsa dinților.;Rozważ rozwiązanie protetyczne lub ortodontyczne, aby zrekompensować braki w uzębieniu.;Considerar uma solução protética ou ortodôntica para compensar a falta de dentes.;失った歯を補うために、補綴や矯正を検討する。;Considerare una soluzione protesica o ortodontica per compensare i denti mancanti.;Considere una solución protésica u ortodóncica para compensar la falta de dientes.;Ziehen Sie eine prothetische oder kieferorthopädische Lösung in Betracht, um das Fehlen von Zähnen zu kompensieren.;Consider a prosthetic or orthodontic solution to compensate for missing teeth.;
alignement;Surveillez la rotation et l'inclinaison. ajustements précis pour l'alignement optimal.;gpt4o;Surveillez la rotation et l'inclinaison. ajustements précis pour l'alignement optimal.;显示器旋转和倾斜，精确调节，实现最佳校准。;مراقبة الدوران والإمالة. تعديلات دقيقة لمحاذاة مثالية.;ตรวจสอบการหมุนและการเอียง ปรับได้อย่างแม่นยำเพื่อการจัดตำแหน่งที่เหมาะสมที่สุด;Rotirea și înclinarea monitorului. Ajustări precise pentru aliniere optimă.;Obracanie i pochylanie monitora. Precyzyjna regulacja zapewniająca optymalne ustawienie.;Rotação e inclinação do monitor. Ajustes precisos para um alinhamento ótimo.;モニターの回転とチルト。 最適なアライメントのための正確な調整。;Rotazione e inclinazione del monitor. Regolazioni precise per un allineamento ottimale.;Rotación e inclinación del monitor. Ajustes precisos para una alineación óptima.;Überwachen Sie die Rotation und Neigung. Präzise Anpassungen für die optimale Ausrichtung.;Monitor rotation and tilt. Precise adjustments for optimum alignment.;
ankylose;Ankylose compromet le déplacement orthodontique. nécessite une approche chirurgicale.;gpt4o;Ankylose compromet le déplacement orthodontique. nécessite une approche chirurgicale.;强直会影响正畸运动，需要进行手术。;يؤثر القُسط على حركة تقويم الأسنان ويتطلب جراحة.;ภาวะข้อติดแข็งส่งผลต่อการเคลื่อนฟันทางทันตกรรมจัดฟัน ต้องใช้วิธีการผ่าตัด;Anchiloza compromite mișcarea ortodontică și necesită intervenție chirurgicală.;Ankyloza upośledza ruch ortodontyczny i wymaga operacji.;A anquilose compromete o movimento ortodôntico e requer cirurgia.;強直症は歯列矯正の動きを損ない、手術が必要となる。;L'anchilosi compromette il movimento ortodontico e richiede un intervento chirurgico.;La anquilosis compromete el movimiento ortodóncico y requiere cirugía.;Ankylose gefährdet die kieferorthopädische Bewegung. erfordert einen chirurgischen Ansatz.;Ankylosis compromises orthodontic movement and requires surgery.;
apnée du sommeil;Considérer un appareil d'avancement mandibulaire pour soulager l'apnée obstructive.;gpt4o;Considérer un appareil d'avancement mandibulaire pour soulager l'apnée obstructive.;考虑使用下颌前突矫正器来缓解阻塞性呼吸暂停。;ضع في اعتبارك استخدام جهاز تقدم الفك السفلي لتخفيف انقطاع النفس الانسدادي.;พิจารณาใช้อุปกรณ์เลื่อนขากรรไกรล่างเพื่อบรรเทาภาวะหยุดหายใจขณะหลับจากการอุดกั้น;Luați în considerare un aparat de avansare mandibulară pentru ameliorarea apneei obstructive.;Rozważ zastosowanie aparatu wysuwającego żuchwę w celu złagodzenia obturacyjnego bezdechu.;Considerar um aparelho de avanço mandibular para aliviar a apneia obstrutiva.;閉塞性無呼吸を緩和するために下顎前突装置を考慮する。;Considerare un apparecchio di avanzamento mandibolare per alleviare l'apnea ostruttiva.;Considerar un aparato de avance mandibular para aliviar la apnea obstructiva.;Ziehen Sie einen Unterkiefervorschubapparat in Betracht, um die obstruktive Apnoe zu lindern.;Consider a mandibular advancement appliance to relieve obstructive apnoea.;
arc;L'arc orthodontique stabilise et guide le mouvement dentaire, essentiel pour l'alignement correct.;gpt4o;L'arc orthodontique stabilise et guide le mouvement dentaire, essentiel pour l'alignement correct.;正畸牙弓可以稳定和引导牙齿移动，这对牙齿的正确排列至关重要。;يعمل قوس تقويم الأسنان على تثبيت وتوجيه حركة الأسنان، وهو أمر ضروري للمحاذاة الصحيحة.;การปรับโครงฟันช่วยให้ฟันเคลื่อนที่อย่างมั่นคงและถูกต้อง ซึ่งเป็นสิ่งจำเป็นสำหรับการจัดฟันให้เรียงตัวอย่างถูกต้อง;Arcada ortodontică stabilizează și ghidează mișcarea dinților, care este esențială pentru alinierea corectă.;Łuk ortodontyczny stabilizuje i kieruje ruchem zębów, co jest niezbędne do ich prawidłowego ustawienia.;A arcada ortodôntica estabiliza e orienta o movimento dos dentes, o que é essencial para um alinhamento correto.;矯正アーチは歯の動きを安定させ、正しい歯並びに必要不可欠なガイドとなります。;L'arco ortodontico stabilizza e guida il movimento dei denti, essenziale per un corretto allineamento.;El arco ortodóncico estabiliza y guía el movimiento de los dientes, lo que es esencial para una alineación correcta.;Der kieferorthopädische Bogen stabilisiert und führt die Zahnbewegung, die für die korrekte Ausrichtung entscheidend ist.;L'orthodontic arch stabilise and guide the movement dentaire, essentiel for l'alignment correct.;
arcade;Surveillez l'expansion transverse pour éviter les déséquilibres occlusaux.;gpt4o;Surveillez l'expansion transverse pour éviter les déséquilibres occlusaux.;监控横向扩张，避免咬合失衡。;مراقبة التمدد العرضي لتجنب الاختلالات الإطباقية.;ติดตามการขยายตัวในแนวนอนเพื่อหลีกเลี่ยงความไม่สมดุลจากการสบฟัน;Monitorizați expansiunea transversală pentru a evita dezechilibrele ocluzale.;Monitoruj ekspansję poprzeczną, aby uniknąć nierównowagi zgryzu.;Monitorizar a expansão transversal para evitar desequilíbrios oclusais.;咬合のアンバランスを避けるため、横方向の拡張を監視する。;Monitorare l'espansione trasversale per evitare squilibri occlusali.;Controlar la expansión transversal para evitar desequilibrios oclusales.;Achten Sie auf die Transversalexpansion, um okklusale Unwuchten zu vermeiden.;Surveillez l'expansion transverse for éviter the déséquilibres occlusaux.;
arthrose;Surveillez l'occlusion et envisagez des gouttières pour soulager les ATM affectées.;gpt4o;Surveillez l'occlusion et envisagez des gouttières pour soulager les ATM affectées.;监测咬合情况，并考虑使用夹板缓解受影响的颞下颌关节。;راقب العضة وفكر في استخدام الجبائر لتخفيف المفصل الصدغي الفكي الصدغي المصاب.;ติดตามการอุดตันและพิจารณาใช้เฝือกเพื่อบรรเทาข้อต่อขากรรไกรที่ได้รับผลกระทบ;Monitorizați mușcătura și luați în considerare atelele pentru a ușura ATM-urile afectate.;Należy monitorować zgryz i rozważyć zastosowanie szyn w celu odciążenia dotkniętych stawów skroniowo-żuchwowych.;Monitorizar a mordida e considerar talas para aliviar as articulações temporomandibulares afectadas.;咬み合わせを観察し、顎関節を緩和するためのスプリントを検討する。;Monitorare il morso e prendere in considerazione bite per alleviare le ATM interessate.;Vigilar la mordida y considerar el uso de férulas para aliviar las ATM afectadas.;Beobachten Sie die Okklusion und ziehen Sie Schienen in Betracht, um die betroffenen Kiefergelenke zu entlasten.;Surveillez l'occlusion and envisagez some gouttières for soulager the atm affectées.;
asymétrie faciale;Évaluer la croissance mandibulaire et maxillaire, envisager des appareils fonctionnels.;gpt4o;Évaluer la croissance mandibulaire et maxillaire, envisager des appareils fonctionnels.;评估下颌和上颌发育情况，考虑功能性矫治器。;تقييم نمو الفك السفلي والفك العلوي، والنظر في الأجهزة الوظيفية.;ประเมินการเจริญเติบโตของขากรรไกรล่างและขากรรไกรบน พิจารณาอุปกรณ์เพื่อแก้ไขการทำงาน;Evaluați creșterea mandibulară și maxilară, luați în considerare aparatele funcționale.;Ocena wzrostu żuchwy i szczęki, rozważenie aparatów funkcjonalnych.;Avaliar o crescimento mandibular e maxilar, considerar aparelhos funcionais.;下顎と上顎の成長を評価し、機能的な器具を検討する。;Valutare la crescita mandibolare e mascellare, considerare gli apparecchi funzionali.;Evaluar el crecimiento mandibular y maxilar, considerar aparatos funcionales.;Beurteilen Sie das Wachstum von Unter- und Oberkiefer, ziehen Sie funktionelle Geräte in Betracht.;Évaluer the growth mandibular and maxilla, envisager some functional devices.;
atm;Évaluez les dysfonctions articulaires pour optimiser le plan de traitement orthodontique.;gpt4o;Évaluez les dysfonctions articulaires pour optimiser le plan de traitement orthodontique.;评估关节功能障碍，优化正畸治疗方案。;تقييم اختلالات المفاصل لتحسين خطة علاج تقويم الأسنان.;ประเมินการทำงานร่วมกันของข้อต่อเพื่อเพิ่มประสิทธิภาพแผนการรักษาทางทันตกรรมจัดฟัน;Evaluarea disfuncțiilor articulare pentru optimizarea planului de tratament ortodontic.;Ocena dysfunkcji stawów w celu optymalizacji planu leczenia ortodontycznego.;Avaliar as disfunções articulares para otimizar o plano de tratamento ortodôntico.;矯正治療計画を最適化するために、関節機能障害を評価する。;Valutare le disfunzioni articolari per ottimizzare il piano di trattamento ortodontico.;Evaluar las disfunciones articulares para optimizar el plan de tratamiento ortodóncico.;Beurteilen Sie Gelenkdysfunktionen, um den kieferorthopädischen Behandlungsplan zu optimieren.;Évaluez the dysfonctions articulaires for optimiser the plan of traitement orthodontique.;
avulsion;Considérer l'avulsion lors de l'éruption ectopique sévère des canines maxillaires.;gpt4o;Considérer l'avulsion lors de l'éruption ectopique sévère des canines maxillaires.;对于上颌犬齿严重异位萌出的病例，可考虑拔除。;النظر في القلع في حالات البزوغ الخارجي الشديد للأنياب الفكية العلوية.;พิจารณาการฉีกขาดในกรณีที่มีการงอกผิดตำแหน่งอย่างรุนแรงของฟันเขี้ยวบน;Luați în considerare avulsia în cazurile de erupție ectopică severă a caninilor maxilari.;W przypadku ciężkiego ektopowego wyrzynania się kłów szczęki należy rozważyć ich wyrwanie.;Considerar a avulsão em casos de erupção ectópica grave dos caninos superiores.;上顎犬歯の重度の異所性萌出症例では剥離を考慮する。;Considerare l'avulsione nei casi di grave eruzione ectopica dei canini mascellari.;Considerar la avulsión en casos de erupción ectópica severa de caninos maxilares.;Erwägung einer Avulsion bei schwerem ektopischem Durchbruch der oberen Eckzähne.;Considérer l'avulsion lors of l'rash ectopique severe some canines maxilla.;
avulsion différée immédiate programmée totale;Planifiez un suivi post-avulsion pour surveiller la cicatrisation et l'alignement.;gpt4o;Planifiez un suivi post-avulsion pour surveiller la cicatrisation et l'alignement.;计划抽吸后的随访，以监测愈合和对齐情况。;خطط لمتابعة ما بعد الاختلاج لمراقبة الشفاء والمحاذاة.;นัดหมายการติดตามผลหลังการถอนฟันเพื่อเฝ้าระวังการหายและการเรียงตัว;Planificați o urmărire post-avulsie pentru a monitoriza vindecarea și alinierea.;Zaplanuj obserwację po wstrząśnieniu mózgu w celu monitorowania gojenia i wyrównania.;Planear um acompanhamento pós-avulsão para monitorizar a cicatrização e o alinhamento.;治癒とアライメントをモニターするために、脱臼後のフォローアップを計画する。;Pianificare un follow-up post-avulsione per monitorare la guarigione e l'allineamento.;Planifique un seguimiento posterior a la clavícula para controlar la cicatrización y la alineación.;Planen Sie eine Nachuntersuchung nach der Avulsion, um die Wundheilung und die Ausrichtung zu überwachen.;Planifiez a follow-up post-avulsion for monitor the cicatrisation and l'alignment.;
aéro;L'aérophagie peut influencer l'occlusion. vérifier la respiration buccale.;gpt4o;L'aérophagie peut influencer l'occlusion. vérifier la respiration buccale.;检查口呼吸。;يمكن أن يؤثر البلعوم الهوائي على الانسداد. تحقق من التنفس عن طريق الفم.;การกลืนอากาศอาจส่งผลต่อการอุดกั้น ตรวจสอบการหายใจทางปาก;Aerofagia poate influența ocluzia. Verificați respirația bucală.;Aerofagia może wpływać na okluzję. Sprawdź oddychanie przez usta.;A aerofagia pode influenciar a oclusão. Verificar a respiração bucal.;口呼吸を確認する。;L'aerofagia può influenzare l'occlusione. Controllare la respirazione con la bocca.;La aerofagia puede influir en la oclusión. Comprobar la respiración bucal.;Aerophagie kann die Okklusion beeinflussen. Überprüfen Sie die Mundatmung.;L'aérophagie peut influencer l'occlusion. vérifier the mouth breathing.;
bagues;Assurez-vous de vérifier le serrage et l'alignement des brackets lors des contrôles réguliers.;gpt4o;Assurez-vous de vérifier le serrage et l'alignement des brackets lors des contrôles réguliers.;确保定期检查支架的紧固和对齐情况。;تأكد من فحص الأقواس للتأكد من إحكامها ومحاذاتها على فترات منتظمة.;โปรดตรวจสอบความแน่นและความตรงของตัวยึดในระหว่างการตรวจสอบตามปกติ;Asigurați-vă că verificați strângerea și alinierea suporturilor la intervale regulate.;Upewnij się, że w regularnych odstępach czasu sprawdzasz dokręcenie i wyrównanie wsporników.;Certifique-se de que verifica o aperto e o alinhamento dos suportes em intervalos regulares.;定期的にブラケットの締め付けとアライメントを確認してください。;Assicuratevi di controllare il serraggio e l'allineamento delle staffe a intervalli regolari.;Asegúrate de comprobar el apriete y la alineación de los soportes en las revisiones periódicas.;Achten Sie bei regelmäßigen Kontrollen darauf, dass die Brackets fest angezogen und ausgerichtet sind.;Assurez-vous of vérifier the serrage and l'alignment some brackets lors some contrôles réguliers.;
bielles;Les bielles corrigent la classe II en avançant la mandibule, favorisent la croissance.;gpt4o;Les bielles corrigent la classe II en avançant la mandibule, favorisent la croissance.;连杆通过推进下颌骨和促进生长来矫正 II 类牙。;تقوم قضبان التوصيل بتصحيح الفئة الثانية عن طريق دفع الفك السفلي وتعزيز النمو.;แท่งโลหะช่วยแก้ไขความผิดปกติของฟันประเภทที่สองโดยการเลื่อนขากรรไกรล่างไปข้างหน้า ส่งเสริมการเจริญเติบโต;Baghetele de conectare corectează clasa II prin avansarea mandibulei și promovarea creșterii.;Łączniki korygują klasę II poprzez wysunięcie żuchwy do przodu i promowanie wzrostu.;As barras de ligação corrigem a Classe II avançando a mandíbula e promovendo o crescimento.;コネクティングロッドは、下顎を前進させ成長を促進することにより、II級を矯正する。;Le barre di collegamento correggono la Classe II facendo avanzare la mandibola e promuovendo la crescita.;Las barras de conexión corrigen la Clase II avanzando la mandíbula y promoviendo el crecimiento.;Pleuel korrigieren Klasse II durch Vorverlagerung des Unterkiefers, fördern das Wachstum.;the connecting rods corrigent the class ii en avançant the mandibule, favorisent the growth.;
bipro;Corriger la biprotrusion avec extraction pour améliorer l'occlusion et l'esthétique.;gpt4o;Corriger la biprotrusion avec extraction pour améliorer l'occlusion et l'esthétique.;通过拔牙矫正双颌前突，改善咬合和美观。;تصحيح النتوء الثنائي مع الاستخراج لتحسين الانسداد والتجميل.;แก้ไขการยื่นของฟันทั้งสองด้านด้วยการถอนฟันเพื่อปรับปรุงการสบฟันและความสวยงาม;Corectați biprotrusion cu extracție pentru a îmbunătăți ocluzia și estetica.;Skoryguj biprotruzję za pomocą ekstrakcji, aby poprawić okluzję i estetykę.;Corrigir a biprotrusão com extração para melhorar a oclusão e a estética.;咬合と審美性を改善するために、抜歯で両突起を矯正する。;Correggere la biprotrusione con l'estrazione per migliorare l'occlusione e l'estetica.;Corregir la biprotrusión con extracción para mejorar la oclusión y la estética.;Korrektur der Biprotrusion mit Extraktion zur Verbesserung der Okklusion und der Ästhetik.;Corriger the biprotrusion with extraction for améliorer l'occlusion and l'aesthetics.;
bruxisme;Surveillance occlusale et gouttière recommandées pour prévenir l'usure dentaire.;gpt4o;Surveillance occlusale et gouttière recommandées pour prévenir l'usure dentaire.;建议使用咬合监测和夹板来防止牙齿磨损。;مراقبة الأسنان والجبائر الموصى بها لمنع تآكل الأسنان.;แนะนำให้เฝ้าระวังการสบฟันและใช้ที่ครอบฟันเพื่อป้องกันการสึกของฟัน;Monitorizare ocluzală și atele recomandate pentru a preveni uzura dinților.;Monitorowanie okluzji i szyny zalecane w celu zapobiegania zużyciu zębów.;Monitorização oclusal e talas recomendadas para evitar o desgaste dentário.;歯の摩耗を防ぐため、咬合モニタリングとスプリントを推奨。;Monitoraggio occlusale e bite consigliati per prevenire l'usura dei denti.;Control oclusal y férulas recomendadas para evitar el desgaste dental.;Okklusale Überwachung und Aufbissschiene zur Vermeidung von Zahnabnutzung empfohlen.;Surveillance occlusale and gutter recommandées for prévenir l'tooth wear.;
bruxisme diurne;Surveillez l'usure dentaire. envisagez une gouttière occlusale pour protection.;gpt4o;Surveillez l'usure dentaire. envisagez une gouttière occlusale pour protection.;监测牙齿磨损情况，考虑使用咬合夹板进行保护。;راقب تآكل الأسنان. ضع في اعتبارك جبيرة الإطباق للحماية.;ติดตามการสึกของฟัน พิจารณาใช้เฝือกสบฟันเพื่อป้องกัน;Monitorizați uzura dinților. Luați în considerare o atelă ocluzală pentru protecție.;Monitoruj zużycie zębów. Rozważ szynę okluzyjną dla ochrony.;Monitorizar o desgaste dos dentes. Considerar uma tala oclusal para proteção.;歯の摩耗を観察し、咬合スプリントによる保護を検討する。;Monitorare l'usura dei denti. Considerare una stecca occlusale come protezione.;Vigile el desgaste de los dientes. Considere la posibilidad de utilizar una férula oclusal como protección.;Achten Sie auf Zahnabnutzung. Ziehen Sie eine okklusale Schiene zum Schutz in Betracht.;Surveillez l'tooth wear. envisagez a gutter occlusale for protection.;
bruxisme diurne sévère;Surveillez l'usure dentaire, envisagez une gouttière occlusale.;gpt4o;Surveillez l'usure dentaire, envisagez une gouttière occlusale.;监测牙齿磨损情况，考虑使用咬合夹板。;راقب تآكل الأسنان، ضع في اعتبارك جبيرة الإطباق.;เฝ้าระวังการสึกของฟันและพิจารณาการใช้เฝือกสบฟัน;Monitorizați uzura dinților, luați în considerare o atelă ocluzală.;Monitoruj zużycie zębów, rozważ szynę okluzyjną.;Monitorizar o desgaste dos dentes, considerar uma tala oclusal.;歯の摩耗を観察し、咬合スプリントを検討する。;Monitorare l'usura dei denti, considerare un bite occlusale.;Vigilar el desgaste dental, considerar una férula oclusal.;Achten Sie auf Zahnabnutzung, ziehen Sie eine okklusale Schiene in Betracht.;Surveillez l'tooth wear, envisagez a gutter occlusale.;
bruxisme modéré;Surveille l'usure dentaire. envisage une gouttière occlusale pour protection.;gpt4o;Surveille l'usure dentaire. envisage une gouttière occlusale pour protection.;监测牙齿磨损情况，考虑使用咬合夹板进行保护。;راقب تآكل الأسنان. ضع في اعتبارك جبيرة إطباق الأسنان للحماية.;ติดตามการสึกของฟัน พิจารณาใช้เฝือกสบฟันเพื่อป้องกัน;Monitorizați uzura dinților. Luați în considerare o atelă ocluzală pentru protecție.;Monitoruj zużycie zębów. Rozważ szynę okluzyjną dla ochrony.;Monitorizar o desgaste dos dentes. Considerar uma tala oclusal para proteção.;歯の摩耗を観察し、咬合スプリントによる保護を考慮する。;Monitorare l'usura dei denti. Considerare una stecca occlusale come protezione.;Vigile el desgaste de los dientes. Considere la posibilidad de utilizar una férula oclusal como protección.;Überwacht die Zahnabnutzung. Zieht zum Schutz eine Okklusalschiene in Betracht.;Surveille l'tooth wear. envisage a gutter occlusale for protection.;
