oripathologie;commentaire;auteur;fr;cn;ar;th;ro;pl;pt;ja;it;es;de;en;
nécrose pulpaire;Surveiller la vitalité dentaire et évaluer un possible traitement endodontique.;gpt4o;Surveiller la vitalité dentaire et évaluer un possible traitement endodontique.;监测牙齿活力，评估可能的牙髓治疗。;مراقبة حيوية الأسنان وتقييم العلاج اللبي المحتمل.;ตรวจสอบความมีชีวิตของฟันและประเมินความจำเป็นในการรักษาทางคลินิก;Monitorizarea vitalității dentare și evaluarea unui posibil tratament endodontic.;Monitorowanie żywotności zębów i ocena ewentualnego leczenia endodontycznego.;Monitorizar a vitalidade dentária e avaliar um possível tratamento endodôntico.;歯の活力をモニターし、歯内療法の可能性を評価する。;Monitorare la vitalità dentale e valutare un eventuale trattamento endodontico.;Controlar la vitalidad dental y evaluar un posible tratamiento endodóntico.;Überwachen Sie die Zahnvitalität und beurteilen Sie eine mögliche endodontische Behandlung.;monitor the vitalité dentaire and évaluer a possible traitement endodontique.;
occlusion croisée;L'occlusion croisée nécessite une expansion maxillaire pour corriger l'alignement dentaire.;gpt4o;L'occlusion croisée nécessite une expansion maxillaire pour corriger l'alignement dentaire.;交叉咬合需要上颌骨扩张来矫正牙齿排列。;تتطلب العضة المتقاطعة توسيع الفك العلوي لتصحيح محاذاة الأسنان.;การสบฟันไขว้จำเป็นต้องขยายกระดูกขากรรไกรบนเพื่อแก้ไขการจัดเรียงของฟัน;Dinții încrucișați necesită expansiune maxilară pentru a corecta alinierea dentară.;Zgryz krzyżowy wymaga poszerzenia szczęki w celu skorygowania ustawienia zębów.;A mordida cruzada requer a expansão da maxila para corrigir o alinhamento dentário.;反対咬合は、歯並びを矯正するために上顎を拡大する必要があります。;Il morso crociato richiede l'espansione mascellare per correggere l'allineamento dentale.;La mordida cruzada requiere una expansión maxilar para corregir la alineación dental.;Der Kreuzbiss erfordert eine Kieferexpansion, um die Zahnausrichtung zu korrigieren.;L'cross bite nécessite a expansion maxilla for corriger l'dental alignment.;
occlusion inversée;Considérer une expansion maxillaire pour corriger la relation de classe III.;gpt4o;Considérer une expansion maxillaire pour corriger la relation de classe III.;考虑扩大上颌骨以矫正 III 类关系。;النظر في توسيع الفك العلوي لتصحيح العلاقة من الفئة الثالثة.;พิจารณาการขยายกระดูกขากรรไกรบนเพื่อแก้ไขการสบฟันผิดปกติประเภทที่ 3;Luați în considerare expansiunea maxilară pentru a corecta relația de clasă III.;Rozważ rozbudowę szczęki w celu skorygowania relacji klasy III.;Considerar a expansão maxilar para corrigir a relação de Classe III.;III級関係を矯正するために上顎の拡大を考慮する。;Considerare l'espansione mascellare per correggere la relazione di Classe III.;Considerar la expansión maxilar para corregir la relación de Clase III.;Ziehen Sie eine Oberkieferexpansion in Betracht, um die Klasse-III-Beziehung zu korrigieren.;Considérer a expansion maxilla for corriger the relation of class iii.;
onychophagie;L'onychophagie peut altérer l'occlusion par usure dentaire et modifier la position des incisives.;gpt4o;L'onychophagie peut altérer l'occlusion par usure dentaire et modifier la position des incisives.;吞咽障碍会通过牙齿磨损改变咬合，并改变门牙的位置。;يمكن أن يغير انسداد الأسنان من خلال تآكل الأسنان وتغيير وضع القواطع.;การกัดเล็บสามารถเปลี่ยนแปลงการกัดเนื่องจากฟันสึกและเปลี่ยนตำแหน่งของฟันหน้า;Onicofagia poate modifica ocluzia prin uzura dinților și schimbarea poziției incisivilor.;Onychofagia może zmienić okluzję poprzez zużycie zębów i zmianę pozycji siekaczy.;A onicofagia pode alterar a oclusão através do desgaste dentário e alterar a posição dos incisivos.;異食症は歯の摩耗によって咬合を変化させ、切歯の位置を変えることがある。;L'onicofagia può alterare l'occlusione attraverso l'usura dei denti e modificare la posizione degli incisivi.;La onicofagia puede alterar la oclusión por desgaste dental y cambiar la posición de los incisivos.;Onychophagie kann die Okklusion durch Zahnabnutzung beeinträchtigen und die Stellung der Schneidezähne verändern.;L'onychophagy peut altérer l'occlusion par tooth wear and modifier the position some incisors.;
ostéotomie;L'ostéotomie optimise l'alignement maxillo-facial, améliorant fonction et esthétique.;gpt4o;L'ostéotomie optimise l'alignement maxillo-facial, améliorant fonction et esthétique.;截骨术可优化颌面部的排列，改善功能和美观。;يحسّن تقويم العظام من محاذاة الوجه والفكين ويحسّن من وظيفة الوجه والفكين وجمالياته.;การตัดกระดูกปรับตำแหน่งช่วยเพิ่มประสิทธิภาพการจัดเรียงของกระดูกขากรรไกรและใบหน้า ทำให้การทำงานและการเสริมสร้างรูปลักษณ์ดีขึ้น;Osteotomia optimizează alinierea maxilofacială, îmbunătățind funcția și estetica.;Osteotomia optymalizuje wyrównanie szczękowo-twarzowe, poprawiając funkcję i estetykę.;A osteotomia optimiza o alinhamento maxilofacial, melhorando a função e a estética.;骨切り術は、顎顔面のアライメントを最適化し、機能と審美性を向上させます。;L'osteotomia ottimizza l'allineamento maxillo-facciale, migliorando la funzione e l'estetica.;La osteotomía optimiza la alineación maxilofacial, mejorando la función y la estética.;Die Osteotomie optimiert die Kiefer- und Gesichtsausrichtung, verbessert die Funktion und die Ästhetik.;L'osteotomy optimise l'alignment maxillo-facial, améliorant fonction and aesthetics.;
panoramique;Analysez les racines et l'alignement dentaire global pour planifier le traitement.;gpt4o;Analysez les racines et l'alignement dentaire global pour planifier le traitement.;分析牙根和整体牙齿排列，制定治疗计划。;تحليل الجذور ومحاذاة الأسنان بشكل عام لتخطيط العلاج.;วิเคราะห์รากฟันและการเรียงตัวของฟันโดยรวมเพื่อวางแผนการรักษา;Analizați rădăcinile și alinierea dentară generală pentru a planifica tratamentul.;Analiza korzeni i ogólnego ustawienia zębów w celu zaplanowania leczenia.;Analisar as raízes e o alinhamento dentário geral para planear o tratamento.;歯根と全体的な歯並びを分析し、治療計画を立てる。;Analizzare le radici e l'allineamento dentale complessivo per pianificare il trattamento.;Analizar las raíces y la alineación dental general para planificar el tratamiento.;Analysieren Sie die Zahnwurzeln und die gesamte Zahnstellung, um die Behandlung zu planen.;Analysez the racines and l'dental alignment global for planifier the traitement.;
pendulum;Le pendulum corrige les classes II en distalant les molaires maxillaires.;gpt4o;Le pendulum corrige les classes II en distalant les molaires maxillaires.;摆锤通过使上颌臼齿远端化来矫正 II 类牙。;يقوم البندول بتصحيح الفئة الثانية عن طريق تقطيع أضراس الفك العلوي.;ลูกตุ้มปรับการสบฟันผิดระดับประเภทที่ 2 โดยการเคลื่อนฟันกรามบนออกไปด้านนอก;Pendulul corectează clasa II prin distalizarea molarilor maxilari.;Wahadło koryguje klasę II poprzez dystalizację zębów trzonowych szczęki.;O pêndulo corrige a Classe II através da distalização dos molares superiores.;ペンデュラムは、上顎臼歯を遠位化することでII級を矯正する。;Il pendolo corregge la Classe II distalizzando i molari mascellari.;El péndulo corrige la Clase II distalando los molares maxilares.;Das Pendulum korrigiert die Klasse II, indem es die Oberkiefermolaren distalisiert.;the pendulum corrige the classes II en distalant the molaires maxilla.;
phonation;Évaluer l'occlusion et la position linguale pour optimiser la phonation du patient.;gpt4o;Évaluer l'occlusion et la position linguale pour optimiser la phonation du patient.;评估咬合和舌位，优化患者的发音。;تقييم الإطباق والوضع اللساني لتحسين نطق المريض.;ประเมินการปิดกั้นและตำแหน่งของลิ้นเพื่อเพิ่มประสิทธิภาพการออกเสียงของผู้ป่วย;Evaluați ocluzia și poziția linguală pentru a optimiza fonația pacientului.;Oceń okluzję i pozycję językową, aby zoptymalizować fonację pacjenta.;Avaliar a oclusão e a posição lingual para otimizar a fonação do doente.;患者の発音を最適化するために、咬合と舌位を評価する。;Valutare l'occlusione e la posizione linguale per ottimizzare la fonazione del paziente.;Evaluar la oclusión y la posición lingual para optimizar la fonación del paciente.;Beurteilen Sie die Okklusion und die Zungenposition, um die Phonation des Patienten zu optimieren.;Évaluer l'occlusion and the position linguale for optimiser the phonation du patient.;
plaque amovible;Améliore la correction des malocclusions mineures chez l'enfant. Contrôle régulier nécessaire.;gpt4o;Améliore la correction des malocclusions mineures chez l'enfant. Contrôle régulier nécessaire.;改善儿童轻微畸形的矫正。需要定期检查。;يحسن من تصحيح حالات سوء الإطباق البسيطة لدى الأطفال. يلزم إجراء فحوصات منتظمة.;ช่วยปรับปรุงการแก้ไขการสบฟันผิดปกติเล็กน้อยในเด็ก จำเป็นต้องมีการติดตามผลอย่างสม่ำเสมอ;Îmbunătățește corectarea malocluziilor minore la copii. Sunt necesare controale regulate.;Poprawia korektę drobnych wad zgryzu u dzieci. Wymagane regularne wizyty kontrolne.;Melhora a correção das más oclusões menores nas crianças. São necessários controlos regulares.;小児の軽度不正咬合の矯正を改善。定期検診が必要。;Migliora la correzione delle malocclusioni minori nei bambini. Sono necessari controlli regolari.;Mejora la corrección de maloclusiones menores en niños. Se requieren revisiones periódicas.;Verbessert die Korrektur kleinerer Malokklusionen bei Kindern. Regelmäßige Kontrolle erforderlich.;Améliore the correction some malocclusions mineures chez l'child. control régulier nécessaire.;
plaque papillon;Plaque papillon : facilite l'expansion transverse, ajustable et confortable pour le patient.;gpt4o;Plaque papillon : facilite l'expansion transverse, ajustable et confortable pour le patient.;蝶形板：便于横向扩张，可调节，病人感觉舒适。;صفيحة الفراشة: تسهل التمدد العرضي، قابلة للتعديل ومريحة للمريض.;จานผีเสื้อ: ช่วยในการขยายขวาง ปรับได้และสบายสำหรับผู้ป่วย;Placă fluture: facilitează expansiunea transversală, reglabilă și confortabilă pentru pacient.;Płytka motylkowa: ułatwia rozszerzanie poprzeczne, regulowana i wygodna dla pacjenta.;Placa borboleta: facilita a expansão transversal, ajustável e confortável para o paciente.;バタフライプレート：横方向への拡張を容易にし、調節可能で患者にとって快適。;Piastra a farfalla: facilita l'espansione trasversale, è regolabile e confortevole per il paziente.;Placa mariposa: facilita la expansión transversal, ajustable y cómoda para el paciente.;Schmetterlingsplatte: erleichtert die Transversalexpansion, anpassbar und bequem für den Patienten.;butterfly plate : facilite l'expansion transverse, ajustable and confortable for the patient.;
plaque y;La plaque Y favorise l'expansion maxillaire et corrige la classe III.;gpt4o;La plaque Y favorise l'expansion maxillaire et corrige la classe III.;Y 型板可促进上颌骨扩张，矫正 III 类畸形。;تعزز الصفيحة Y من تمدد الفك العلوي وتصحح الفئة الثالثة.;แผ่น Y ช่วยส่งเสริมการขยายของขากรรไกรบนและแก้ไขการสบฟันผิดปกติประเภทที่ 3;Placa Y promovează expansiunea maxilară și corectează clasa III.;Płytka Y wspomaga ekspansję szczęki i koryguje klasę III.;A placa em Y promove a expansão maxilar e corrige a Classe III.;Y-プレートは上顎の拡大を促進し、III級を矯正します。;La placca a Y favorisce l'espansione mascellare e corregge la Classe III.;La placa en Y favorece la expansión maxilar y corrige la Clase III.;Die Y-Platte fördert die Kieferexpansion und korrigiert die Klasse III.;the plate y favorise l'expansion maxilla and corrige the class iii.;
plaque éventail;Optimise l'expansion transversale maxillaire, adaptée pour patients en croissance.;gpt4o;Optimise l'expansion transversale maxillaire, adaptée pour patients en croissance.;优化上颌骨横向扩张，适合成长中的患者。;يحسّن التمدد العرضي الفكي العلوي، وهو مناسب للمرضى في طور النمو.;เพิ่มการขยายตัวในแนวกว้างของขากรรไกรบนอย่างเหมาะสม เหมาะสำหรับผู้ป่วยที่กำลังเจริญเติบโต;Optimizează expansiunea transversală maxilară, potrivită pentru pacienții în creștere.;Optymalizuje poprzeczną ekspansję szczęki, odpowiednią dla rosnących pacjentów.;Optimiza a expansão transversal do maxilar, adequada para pacientes em crescimento.;上顎の横方向の拡張を最適化し、成長期の患者に適しています。;Ottimizza l'espansione trasversale mascellare, adatta ai pazienti in crescita.;Optimiza la expansión transversal maxilar, adecuada para pacientes en crecimiento.;Optimiert die transversale Ausdehnung des Oberkiefers, geeignet für wachsende Patienten.;Optimise l'expansion transversale maxilla, adaptée for patients en growth.;
proalvéolie;Proalvéolie : incisives trop vestibulées. Vérifier le surplomb antérieur.;gpt4o;Proalvéolie : incisives trop vestibulées. Vérifier le surplomb antérieur.;前臼齿：门齿前庭过大。检查前悬。;القواطع الأمامية: القواطع دهليزية جداً. تحقق من البروز الأمامي.;โปรอัลวีโอลิซึม: ฟันตัดอยู่ด้านเวสติบูลมากเกินไป ตรวจสอบการยื่นเกินด้านหน้า;Proalveolus: incisivi prea vestibulari. Verificați supraînălțarea anterioară.;Proalveolus: siekacze zbyt przedsionkowe. Sprawdź zwis przedni.;Proalveolus: incisivos demasiado vestibulares. Verificar a saliência anterior.;前歯槽骨：切歯が前庭的すぎる。前歯の張り出しを確認する。;Proalveolo: incisivi troppo vestibolari. Controllare la sporgenza anteriore.;Proalveolo: incisivos demasiado vestibulares. Comprobar el saliente anterior.;Proalveolie: Zu stark vestibulierte Schneidezähne. Prüfen Sie den anterioren Überhang.;proalveolysis : incisors trop vestibulées. Vérifier the overhang previous.;
proalvéolie mandibulaire;Corriger par ancrage distal, vérifier la réciprocité occlusale.;gpt4o;Corriger par ancrage distal, vérifier la réciprocité occlusale.;用远端锚固进行矫正，检查咬合对等性。;التصحيح مع التثبيت القاصي، والتحقق من المعاملة بالمثل الإطباقية.;แก้ไขด้วยการยึดที่ปลายสุด ตรวจสอบการสบฟันแบบสลับกัน;Corectați cu ancorare distală, verificați reciprocitatea ocluzală.;Skoryguj z zakotwieniem dystalnym, sprawdź wzajemność okluzji.;Corrigir com ancoragem distal, verificar a reciprocidade oclusal.;ディスタルアンカレッジで矯正し、咬合の相互性をチェックする。;Correggere con l'ancoraggio distale, controllare la reciprocità occlusale.;Corregir con anclaje distal, comprobar reciprocidad oclusal.;Durch distale Verankerung korrigieren, okklusale Reziprozität überprüfen.;Corriger par ancrage distal, vérifier the réciprocité occlusale.;
proglissement;Le proglissement nécessite une analyse occlusale pour ajuster le plan de traitement.;gpt4o;Le proglissement nécessite une analyse occlusale pour ajuster le plan de traitement.;前移需要进行咬合分析，以调整治疗方案。;يتطلب تحليل الإطباق المسبق تحليل الإطباق لضبط خطة العلاج.;ความก้าวหน้าต้องการการวิเคราะห์การสบฟันเพื่อปรับแผนการรักษา;Progliding necesită o analiză ocluzală pentru a ajusta planul de tratament.;Progliding wymaga analizy okluzyjnej w celu dostosowania planu leczenia.;O Progliding requer uma análise oclusal para ajustar o plano de tratamento.;プログライディングには、治療計画を調整するための咬合分析が必要です。;La progressione richiede un'analisi occlusale per adattare il piano di trattamento.;El progliding requiere un análisis oclusal para ajustar el plan de tratamiento.;Progression erfordert eine Okklusionsanalyse, um den Behandlungsplan anzupassen.;the slippage nécessite a analyse occlusale for ajuster the plan of traitement.;
prognathisme mandibulaire;Considérer une chirurgie orthognathique pour corriger la dysmorphie.;gpt4o;Considérer une chirurgie orthognathique pour corriger la dysmorphie.;考虑通过正颌手术来矫正畸形。;النظر في إجراء جراحة تقويم الفكين لتصحيح خلل التشوه.;พิจารณาการผ่าตัดกระดูกขากรรไกรเพื่อแก้ไขความผิดปกติของรูปร่าง;Luați în considerare chirurgia ortognatică pentru a corecta dismorfia.;Rozważ operację ortognatyczną w celu skorygowania dysmorfii.;Considerar a cirurgia ortognática para corrigir a dismorfia.;異形成を矯正するために顎矯正手術を検討する。;Considerare la chirurgia ortognatica per correggere la dismorfia.;Considerar la cirugía ortognática para corregir la dismorfia.;Orthognathe Chirurgie zur Korrektur der Dysmorphie in Betracht ziehen.;Considérer a orthognathic surgery for corriger the dysmorphia.;
prognathisme mandibulaire modéré sévère;Considérer une approche chirurgicale combinée à l'orthodontie pour corriger l'occlusion.;gpt4o;Considérer une approche chirurgicale combinée à l'orthodontie pour corriger l'occlusion.;考虑采用手术结合正畸的方法来矫正咬合。;فكر في اتباع نهج جراحي مقترن بتقويم الأسنان لتصحيح الإطباق.;พิจารณาการผ่าตัดร่วมกับการจัดฟันเพื่อแก้ไขการสบฟัน;Luați în considerare o abordare chirurgicală combinată cu ortodonția pentru a corecta ocluzia.;Rozważ podejście chirurgiczne w połączeniu z ortodoncją w celu skorygowania zgryzu.;Considerar uma abordagem cirúrgica combinada com ortodontia para corrigir a oclusão.;外科的アプローチと歯科矯正を併用した咬合矯正を検討する。;Considerare un approccio chirurgico combinato con l'ortodonzia per correggere l'occlusione.;Considere un enfoque quirúrgico combinado con ortodoncia para corregir la oclusión.;Ziehen Sie einen chirurgischen Ansatz in Kombination mit Kieferorthopädie in Betracht, um die Okklusion zu korrigieren.;Considérer a approche chirurgicale combinée to l'orthodontie for corriger l'occlusion.;
prognathisme maxillaire;Évaluer la relation occlusale et envisager l'orthopédie fonctionnelle.;gpt4o;Évaluer la relation occlusale et envisager l'orthopédie fonctionnelle.;评估咬合关系并考虑功能性矫形。;تقييم علاقة الإطباق والنظر في تقويم الأسنان الوظيفي.;ประเมินความสัมพันธ์ของการสบฟันและพิจารณาการแก้ไขทางออร์โธปิดิกส์เชิงหน้าที่;Evaluați relația ocluzală și luați în considerare ortopedia funcțională.;Ocenić relacje zgryzowe i rozważyć ortopedię funkcjonalną.;Avaliar a relação oclusal e considerar a ortopedia funcional.;咬合関係を評価し、機能的矯正を考慮する。;Valutare la relazione occlusale e considerare l'ortopedia funzionale.;Evaluar la relación oclusal y considerar la ortopedia funcional.;Beurteilen Sie die okklusale Beziehung und erwägen Sie eine funktionelle Orthopädie.;Évaluer the relation occlusale and envisager l'orthopédie fonctionnelle.;
prognathisme maxillaire modéré;Surveillance régulière et évaluation pour plan de traitement adapté.;gpt4o;Surveillance régulière et évaluation pour plan de traitement adapté.;定期监测和评估，以制定适当的治疗计划。;الرصد والتقييم المنتظم لخطة العلاج المناسبة.;การติดตามและประเมินผลอย่างสม่ำเสมอเพื่อวางแผนการรักษาที่เหมาะสม;Monitorizare și evaluare periodică pentru un plan de tratament adecvat.;Regularne monitorowanie i ocena pod kątem odpowiedniego planu leczenia.;Acompanhamento e avaliação regulares para um plano de tratamento adequado.;適切な治療計画のための定期的なモニタリングと評価。;Monitoraggio e valutazione regolari per un piano di trattamento appropriato.;Seguimiento y evaluación periódicos para un plan de tratamiento adecuado.;Regelmäßige Überwachung und Beurteilung für einen angepassten Behandlungsplan.;Surveillance régulière and évaluation for plan of traitement adapté.;
prognathisme maxillaire modéré sévère;Considérer la chirurgie orthognathique pour corriger l'occlusion.;gpt4o;Considérer la chirurgie orthognathique pour corriger l'occlusion.;考虑进行正颌手术来矫正咬合。;النظر في إجراء جراحة تقويم الفكين لتصحيح الانسداد.;พิจารณาการผ่าตัดกระดูกขากรรไกรเพื่อแก้ไขการสบฟัน;Luați în considerare chirurgia ortognatică pentru a corecta ocluzia.;Rozważ operację ortognatyczną w celu skorygowania okluzji.;Considerar a cirurgia ortognática para corrigir a oclusão.;咬合を矯正するために顎矯正手術を考慮する。;Considerare la chirurgia ortognatica per correggere l'occlusione.;Considerar la cirugía ortognática para corregir la oclusión.;Orthognathe Chirurgie zur Korrektur der Okklusion erwägen.;Considérer the orthognathic surgery for corriger l'occlusion.;
prognathisme maxillaire sévère;Considérer chirurgie orthognathique pour corriger l'occlusion.;gpt4o;Considérer chirurgie orthognathique pour corriger l'occlusion.;考虑通过正颌手术矫正咬合。;النظر في إجراء جراحة تقويم الأسنان لتصحيح الانسداد.;พิจารณาการผ่าตัดกระดูกขากรรไกรเพื่อแก้ไขการสบฟัน;Luați în considerare chirurgia ortognatică pentru a corecta ocluzia.;Rozważ operację ortognatyczną w celu skorygowania okluzji.;Considerar a cirurgia ortognática para corrigir a oclusão.;咬合を矯正するために顎矯正手術を考慮する。;Considerare la chirurgia ortognatica per correggere l'occlusione.;Considerar la cirugía ortognática para corregir la oclusión.;Orthognathe Chirurgie zur Korrektur der Okklusion erwägen.;Considérer orthognathic surgery for corriger l'occlusion.;
