oripathologie;commentaire;auteur;fr;cn;ar;th;ro;pl;pt;ja;it;es;de;en;
détartrage;Le détartrage prévient l'inflammation gingivale, essentiel avant la pose des appareils.;gpt4o;Le détartrage prévient l'inflammation gingivale, essentiel avant la pose des appareils.;洗牙可以防止牙龈发炎，这在安装牙套前至关重要。;يمنع التقشير التهاب اللثة، وهو أمر ضروري قبل تركيب تقويم الأسنان.;การขูดหินปูนช่วยป้องกันการอักเสบของเหงือก ซึ่งเป็นสิ่งสำคัญก่อนการติดเครื่องมือจัดฟัน;Detartrajul previne inflamarea gingiilor, ceea ce este esențial înainte de montarea aparaturii dentare.;Skaling zapobiega stanom zapalnym dziąseł, co jest niezbędne przed założeniem aparatu ortodontycznego.;A destartarização previne a inflamação das gengivas, que é essencial antes da colocação do aparelho.;スケーリングは歯肉の炎症を防ぐもので、歯列矯正の前には欠かせません。;La detartrasi previene l'infiammazione delle gengive, essenziale prima dell'applicazione dell'apparecchio.;El raspado previene la inflamación de las encías, lo cual es esencial antes de colocar los brackets.;Die Zahnsteinentfernung beugt Zahnfleischentzündungen vor, was vor dem Einsetzen der Zahnspange unerlässlich ist.;the descaling prévient l'gingival inflammation, essentiel before the pose some appareils.;
déviation mandibulaire;Surveillez l'occlusion pour ajuster les forces correctrices et prévenir l'asymétrie fonctionnelle.;gpt4o;Surveillez l'occlusion pour ajuster les forces correctrices et prévenir l'asymétrie fonctionnelle.;监测咬合情况，以调整矫正力，防止功能不对称。;مراقبة الانسداد لضبط القوى التصحيحية ومنع عدم التناسق الوظيفي.;ติดตามการอุดตันเพื่อปรับแรงแก้ไขและป้องกันการเกิดความไม่สมดุลในการทำงาน;Monitorizați ocluzia pentru a ajusta forțele corective și pentru a preveni asimetria funcțională.;Monitorowanie okluzji w celu dostosowania sił korekcyjnych i zapobiegania asymetrii funkcjonalnej.;Monitorizar a oclusão para ajustar as forças corretivas e evitar a assimetria funcional.;咬合をモニターして矯正力を調整し、機能的な非対称性を防ぐ。;Monitorare l'occlusione per regolare le forze correttive e prevenire l'asimmetria funzionale.;Controlar la oclusión para ajustar las fuerzas correctoras y evitar la asimetría funcional.;Überwachen Sie die Okklusion, um die Korrekturkräfte anzupassen und einer funktionellen Asymmetrie vorzubeugen.;Surveillez l'occlusion for ajuster the forces correctrices and prévenir l'asymmetry fonctionnelle.;
déviation maxillaire;Évaluer l'occlusion et l'articulation temporo-mandibulaire.;gpt4o;Évaluer l'occlusion et l'articulation temporo-mandibulaire.;评估咬合和颞下颌关节。;تقييم الانسداد والمفصل الصدغي الفكي.;ประเมินการอุดกั้นและการทำงานของข้อต่อขากรรไกร;Evaluați ocluzia și articulația temporo-mandibulară.;Ocenić okluzję i staw skroniowo-żuchwowy.;Avaliar a oclusão e a articulação temporomandibular.;咬合と顎関節を評価する。;Valutare l'occlusione e l'articolazione temporo-mandibolare.;Evaluar la oclusión y la articulación temporomandibular.;Beurteilen Sie die Okklusion und die Kiefergelenke.;Évaluer l'occlusion and l'temporomandibular joint.;
ectopie;Ectopie dentaire détectée, envisager un traitement interceptif pour réaligner l'arcade.;gpt4o;Ectopie dentaire détectée, envisager un traitement interceptif pour réaligner l'arcade.;发现牙齿异位，考虑进行阻塞性治疗，以重新排列牙弓。;إذا تم الكشف عن تقوس الأسنان، ففكر في العلاج الاعتراضي لإعادة تنظيم القوس.;ตรวจพบฟันขึ้นผิดตำแหน่ง; ควรพิจารณาการรักษาเชิงป้องกันเพื่อจัดแนวฟันให้เข้าที่;Ectopie dentară detectată, luați în considerare tratamentul interceptiv pentru a realinia arcada.;Wykryto ektopię zębów, należy rozważyć leczenie interceptywne w celu wyrównania łuku zębowego.;歯列外反が検出された場合、アーチを整えるためのインターセプティブ治療を検討する。;デンタルエクトピー détectée, envisager a インターセプティブ治療 にとって réaligner l'アーケード.;Rilevata un'ectopia dentale, considerare un trattamento intercettivo per riallineare l'arcata.;Detectada ectopia dental, considerar tratamiento interceptivo para realinear la arcada.;Zahnektopie festgestellt, interzeptive Behandlung zur Neuausrichtung des Zahnbogens erwägen.;dental ectopy détectée, envisager a interceptive treatment for réaligner l'arcade.
ef;Surveiller l'éruption des incisives secondaires pour éviter les encombrements futurs.;gpt4o;Surveiller l'éruption des incisives secondaires pour éviter les encombrements futurs.;监测次切牙的萌出情况，避免将来出现拥挤。;راقب بزوغ القواطع الثانوية لتجنب الازدحام المستقبلي.;เฝ้าระวังการขึ้นของฟันตัดซี่ที่สองเพื่อป้องกันการซ้อนเกในอนาคต;Monitorizați erupția incisivilor secundari pentru a evita aglomerarea viitoare.;Monitoruj erupcję drugorzędnych siekaczy, aby uniknąć stłoczenia w przyszłości.;Monitorizar a erupção dos incisivos secundários para evitar futuros apinhamentos.;将来の叢生を避けるため、副切歯の萌出を観察する。;Monitorare l'eruzione degli incisivi secondari per evitare affollamenti futuri.;Vigilar la erupción de los incisivos secundarios para evitar futuros apiñamientos.;Überwachen Sie den Durchbruch der sekundären Schneidezähne, um zukünftige Engstände zu vermeiden.;monitor l'rash some incisors secondaires for éviter the congestion futurs.;
empreinte;Assurez-vous d'obtenir des marges précises pour une adaptation optimale des appareils.;gpt4o;Assurez-vous d'obtenir des marges précises pour une adaptation optimale des appareils.;确保获得准确的边距，以达到最佳配合。;تأكد من حصولك على هوامش دقيقة لملاءمة مثالية.;โปรดตรวจสอบให้แน่ใจว่าคุณได้กำหนดระยะขอบอย่างแม่นยำเพื่อให้อุปกรณ์สามารถปรับใช้งานได้อย่างเหมาะสมที่สุด;Asigurați-vă că obțineți marje exacte pentru o potrivire optimă.;Upewnij się, że masz dokładne marginesy dla optymalnego dopasowania.;Certifique-se de que obtém margens precisas para um ajuste ótimo.;最適なフィット感を得るために、正確なマージンを確保してください。;Assicuratevi di ottenere margini precisi per un adattamento ottimale.;Asegúrese de obtener márgenes precisos para un ajuste óptimo.;Stellen Sie sicher, dass Sie genaue Ränder erhalten, damit die Geräte optimal passen.;Assurez-vous d'obtenir some marges précises for a adaptation optimale some appareils.;
endoalvéolie mandibulaire modérée;Considérer une disjonction mandibulaire pour améliorer l'occlusion.;gpt4o;Considérer une disjonction mandibulaire pour améliorer l'occlusion.;考虑采用下颌分离术来改善咬合。;فك الفك السفلي لتحسين الإطباق.;พิจารณาการแยกขากรรไกรล่างเพื่อปรับปรุงการสบฟัน;Luați în considerare o disjuncție mandibulară pentru a îmbunătăți ocluzia.;Rozważ rozłączenie żuchwy w celu poprawy okluzji.;Considerar uma disjunção mandibular para melhorar a oclusão.;咬合を改善するために下顎離断を考慮する。;Considerare una disgiunzione mandibolare per migliorare l'occlusione.;Considerar una disyunción mandibular para mejorar la oclusión.;Erwägen Sie eine Unterkieferdisjunktion, um die Okklusion zu verbessern.;Considérer a disconnection mandibular for améliorer l'occlusion.;
endoalvéolie maxillaire sévère;Considérer une expansion palatine rapide pour corriger l'endoalvéolie maxillaire sévère.;gpt4o;Considérer une expansion palatine rapide pour corriger l'endoalvéolie maxillaire sévère.;考虑快速扩张腭部，矫正严重的上颌内翻。;النظر في التوسيع السريع للحنك لتصحيح التمدد الحنك الحاد في الفك العلوي.;พิจารณาการขยายเพดานปากอย่างรวดเร็วเพื่อแก้ไขการตีบแคบของกระดูกขากรรไกรบนภายในเหงือกอย่างรุนแรง;Luați în considerare expansiunea palatală rapidă pentru a corecta endoalveola maxilară severă.;Rozważ szybką ekspansję podniebienia w celu skorygowania ciężkiego wyrostka zębodołowego szczęki.;Considerar a expansão rápida do palato para corrigir o endoalveolo maxilar grave.;重度の上顎内反症を改善するために、急速な口蓋拡大を考慮する。;Considerare una rapida espansione palatale per correggere un grave endoalveolo mascellare.;Considerar la expansión rápida del paladar para corregir el endoalveolo maxilar severo.;Ziehen Sie eine schnelle palatinale Expansion in Betracht, um eine schwere maxilläre Endoalveolie zu korrigieren.;Considérer a expansion palatine rapide for corriger l'endoalveolus maxilla severe.;
fil qui pique;Vérifier la longueur du fil distal, envisager un recourbement ou une coupe.;gpt4o;Vérifier la longueur du fil distal, envisager un recourbement ou une coupe.;检查远端导线的长度，并考虑将其弯曲或剪断。;تحقق من طول السلك البعيد وفكر في ثنيه أو قطعه.;ตรวจสอบความยาวของลวดส่วนปลาย พิจารณาการดัดหรือตัดลวด;Verificați lungimea firului distal și luați în considerare îndoirea sau tăierea acestuia.;Sprawdź długość dystalnego drutu i rozważ jego wygięcie lub przycięcie.;Verificar o comprimento do fio distal e considerar a possibilidade de o dobrar ou cortar.;遠位ワイヤーの長さを確認し、曲げたり切ったりすることを検討する。;Controllare la lunghezza del filo distale e valutare se piegarlo o tagliarlo.;Compruebe la longitud del alambre distal y considere la posibilidad de doblarlo o cortarlo.;Die Länge des distalen Drahts überprüfen, eine Biegung oder einen Schnitt in Erwägung ziehen.;Vérifier the longueur du wire distal, envisager a recourbement or a coupe.;
gingivite;Surveillez l'hygiène buccale et envisagez un détartrage pour prévenir l'inflammation gingivale.;gpt4o;Surveillez l'hygiène buccale et envisagez un détartrage pour prévenir l'inflammation gingivale.;监测口腔卫生并考虑洗牙，以防止牙龈发炎。;راقب نظافة الفم وفكر في التقشير لمنع التهاب اللثة.;ติดตามความสะอาดในช่องปากและพิจารณาการขูดหินปูนเพื่อป้องกันการอักเสบของเหงือก;Monitorizați igiena orală și luați în considerare detartrajul pentru a preveni inflamația gingiilor.;Monitoruj higienę jamy ustnej i rozważ skaling, aby zapobiec zapaleniu dziąseł.;Monitorizar a higiene oral e considerar a destartarização para prevenir a inflamação das gengivas.;口腔衛生を監視し、歯肉の炎症を予防するためにスケーリングを考慮する。;Monitorare l'igiene orale e considerare la possibilità di effettuare una detartrasi per prevenire l'infiammazione gengivale.;Vigilar la higiene bucal y considerar el raspado para prevenir la inflamación de las encías.;Achten Sie auf die Mundhygiene und ziehen Sie eine Zahnreinigung in Betracht, um Zahnfleischentzündungen vorzubeugen.;Surveillez l'hygiene buccale and envisagez a descaling for prévenir l'gingival inflammation.;
herbst;L'appareil Herbst corrige la classe II en avançant la mandibule, stabilisant l'occlusion.;gpt4o;L'appareil Herbst corrige la classe II en avançant la mandibule, stabilisant l'occlusion.;赫氏矫治器通过推进下颌骨，稳定咬合来矫正二类牙。;يعمل جهاز هيربست على تصحيح الفئة الثانية من خلال تقديم الفك السفلي وتثبيت الإطباق.;เครื่องมือ Herbst ช่วยแก้ไขการสบฟันผิดปกติประเภทที่ 2 โดยการเลื่อนขากรรไกรล่างไปข้างหน้าและทำให้การสบฟันมีความมั่นคง;Aparatul Herbst corectează clasa II prin avansarea mandibulei, stabilizând ocluzia.;Aparat Herbsta koryguje klasę II poprzez wysunięcie żuchwy do przodu, stabilizując zgryz.;O aparelho Herbst corrige a Classe II através do avanço da mandíbula, estabilizando a oclusão.;Herbst装置は、下顎を前進させ、咬合を安定させることで、II級を矯正します。;L'apparecchio di Herbst corregge la Classe II facendo avanzare la mandibola e stabilizzando l'occlusione.;El aparato de Herbst corrige la Clase II mediante el avance de la mandíbula, estabilizando la oclusión.;Die Herbst-Apparatur korrigiert die Klasse II, indem sie den Unterkiefer vorschiebt und so die Okklusion stabilisiert.;L'appareil herbst corrige the class ii en avançant the mandibule, stabilisant l'occlusion.;
incisive;Contrôle l'alignement incisif pour éviter récidive post-traitement.;gpt4o;Contrôle l'alignement incisif pour éviter récidive post-traitement.;检查切口排列，避免治疗后复发。;تحقق من محاذاة القواطع لتجنب تكرار ما بعد العلاج.;ตรวจสอบแนวการเรียงตัวของขอบฟันเพื่อป้องกันการกลับมาเป็นซ้ำหลังการรักษา;Verificați alinierea incisivă pentru a evita reapariția post-tratament.;Sprawdź ustawienie siekaczy, aby uniknąć nawrotów po leczeniu.;Verificar o alinhamento incisal para evitar recidivas após o tratamento.;治療後の再発を防ぐため、切歯のアライメントをチェックしてください。;Controllare l'allineamento incisale per evitare recidive post-trattamento.;Comprobar la alineación incisal para evitar recidivas tras el tratamiento.;Kontrolliert die Inzisalausrichtung, um ein Rezidiv nach der Behandlung zu vermeiden.;control l'alignment incisive for éviter relapse post-traitement.;
incisive centrale;Surveillez l'alignement et la rotation pour éviter diastème ou chevauchement.;gpt4o;Surveillez l'alignement et la rotation pour éviter diastème ou chevauchement.;检查对齐和旋转情况，避免出现错位或重叠。;تحقق من المحاذاة والدوران لتجنب الانبساط أو التداخل.;ตรวจสอบการจัดแนวและการหมุนเพื่อหลีกเลี่ยงช่องว่างระหว่างฟันหรือการซ้อนทับกัน;Verificați alinierea și rotația pentru a evita diastema sau suprapunerea.;Sprawdź wyrównanie i obrót, aby uniknąć diastemy lub nakładania się.;Verificar o alinhamento e a rotação para evitar diastemas ou sobreposições.;アライメントと回転をチェックし、ジアステマやオーバーラップを避ける。;Controllare l'allineamento e la rotazione per evitare diastema o sovrapposizioni.;Compruebe la alineación y la rotación para evitar diastemas o solapamientos.;Achten Sie auf Ausrichtung und Rotation, um Diastema oder Überlappungen zu vermeiden.;Surveillez l'alignment and the rotation for éviter diastema or overlap.;
inclusion;Surveillance radiologique régulière nécessaire pour détection précoce et planification du traitement.;gpt4o;Surveillance radiologique régulière nécessaire pour détection précoce et planification du traitement.;为了及早发现和制定治疗计划，有必要定期进行放射学监测。;المراقبة الإشعاعية المنتظمة ضرورية للكشف المبكر والتخطيط للعلاج.;การติดตามทางรังสีวิทยาเป็นประจำมีความจำเป็นเพื่อการตรวจพบในระยะแรกและการวางแผนการรักษา;Monitorizarea radiologică periodică este necesară pentru detectarea precoce și planificarea tratamentului.;Regularne monitorowanie radiologiczne jest niezbędne do wczesnego wykrywania i planowania leczenia.;A monitorização radiológica regular é necessária para a deteção precoce e o planeamento do tratamento.;早期発見と治療計画のためには、定期的な放射線モニタリングが必要である。;Il monitoraggio radiologico regolare è necessario per la diagnosi precoce e la pianificazione del trattamento.;El seguimiento radiológico regular es necesario para la detección precoz y la planificación del tratamiento.;Regelmäßige radiologische Überwachung zur Früherkennung und Behandlungsplanung erforderlich.;Surveillance radiologique régulière nécessaire for détection précoce and planification du traitement.;
infraclusion;Surveillance nécessaire. peut nécessiter une intervention si elle affecte l'occlusion fonctionnelle.;gpt4o;Surveillance nécessaire. peut nécessiter une intervention si elle affecte l'occlusion fonctionnelle.;如果影响功能性闭塞，可能需要干预。;المراقبة مطلوبة. قد يتطلب الأمر التدخل إذا كان يؤثر على الانسداد الوظيفي.;ต้องมีการติดตามผล อาจต้องมีการแทรกแซงหากส่งผลกระทบต่อการสบฟัน;Monitorizare necesară. poate necesita intervenție dacă afectează ocluzia funcțională.;Wymagane monitorowanie. Może wymagać interwencji, jeśli wpływa na funkcjonalną okluzję.;É necessária monitorização. Pode exigir intervenção se afetar a oclusão funcional.;モニタリングが必要である。機能的咬合に影響する場合は介入が必要な場合もある。;È necessario un monitoraggio. può richiedere un intervento se influisce sull'occlusione funzionale.;Requiere seguimiento. Puede requerir intervención si afecta a la oclusión funcional.;Überwachung erforderlich. Kann eine Intervention erfordern, wenn sie die funktionelle Okklusion beeinträchtigt.;Surveillance nécessaire. peut nécessiter a intervention si elle affecte l'occlusion fonctionnelle.;
infraposition;Surveillance nécessaire pour éviter l'ankylose ou la résorption radiculaire.;gpt4o;Surveillance nécessaire pour éviter l'ankylose ou la résorption radiculaire.;需要进行监测，以防止强直或牙根吸收。;المراقبة المطلوبة لمنع حدوث تقشر أو ارتشاف الجذور.;การเฝ้าระวังเป็นสิ่งจำเป็นเพื่อป้องกันการยึดติดหรือการละลายของรากฟัน;Monitorizarea este necesară pentru a preveni anchiloza sau resorbția radiculară.;Wymagane monitorowanie w celu zapobiegania ankylozie lub resorpcji korzeni.;É necessária monitorização para evitar anquilose ou reabsorção radicular.;アンキローシスや歯根吸収を防ぐために、モニタリングが必要である。;È necessario un monitoraggio per prevenire l'anchilosi o il riassorbimento radicolare.;Monitorización necesaria para prevenir la anquilosis o la reabsorción radicular.;Überwachung erforderlich, um eine Ankylose oder Wurzelresorption zu vermeiden.;Surveillance nécessaire for éviter l'ankylosis or the root resorption.;
ingression;L'ingression réduit l'extrusion dentaire, optimisant l'occlusion et la fonction masticatoire.;gpt4o;L'ingression réduit l'extrusion dentaire, optimisant l'occlusion et la fonction masticatoire.;内陷可减少牙齿挤压，优化咬合和咀嚼功能。;يقلل الدخول من انبثاق الأسنان، مما يحسّن من الإطباق ووظيفة المضغ.;การแทรกซึมช่วยลดการยื่นของฟัน ลดการสบฟันที่ผิดปกติ และเพิ่มประสิทธิภาพในการบดเคี้ยว;Intrarea reduce extrudarea dentară, optimizând ocluzia și funcția masticatorie.;Ingresja zmniejsza ekstruzję zębów, optymalizując okluzję i funkcję żucia.;A invasão reduz a extrusão dentária, optimizando a oclusão e a função mastigatória.;歯列の突出を抑え、咬合と咀嚼機能を最適化します。;L'ingressione riduce l'estrusione dentale, ottimizzando l'occlusione e la funzione masticatoria.;La ingresión reduce la extrusión dental, optimizando la oclusión y la función masticatoria.;Die Ingression reduziert die Zahnextrusion und optimiert so die Okklusion und die Kaufunktion.;L'ingression réduit l'extrusion dentaire, optimisant l'occlusion and the chewing function.;
interposition linguale;L'interposition linguale peut entraîner une malocclusion antérieure.;gpt4o;L'interposition linguale peut entraîner une malocclusion antérieure.;舌侧插植可导致前牙错位。;يمكن أن يؤدي التداخل اللساني إلى سوء الإطباق الأمامي.;การแทรกซ้อนของลิ้นสามารถนำไปสู่การสบฟันผิดปกติด้านหน้า;Interpoziția linguală poate duce la o malocluzie anterioară.;Interpozycja lingwalna może prowadzić do wady zgryzu w odcinku przednim.;A interposição lingual pode levar a uma má oclusão anterior.;舌側咬合は前歯部の不正咬合を引き起こす可能性があります。;L'interposizione linguale può portare a una malocclusione anteriore.;La interposición lingual puede provocar una maloclusión anterior.;Die linguale Interposition kann zu einer vorderen Malokklusion führen.;L'lingual interposition peut entraîner a malocclusion previous.;
latérodéviation gauche mandibulaire;Vérifier l'occlusion et évaluer le besoin d'une correction fonctionnelle.;gpt4o;Vérifier l'occlusion et évaluer le besoin d'une correction fonctionnelle.;检查咬合情况，评估是否需要进行功能矫正。;التحقق من الانسداد وتقييم الحاجة إلى التصحيح الوظيفي.;ตรวจสอบการอุดกั้นและประเมินความจำเป็นในการแก้ไขการทำงาน;Verificați ocluzia și evaluați nevoia de corecție funcțională.;Sprawdź okluzję i oceń potrzebę korekty funkcjonalnej.;Verificar a oclusão e avaliar a necessidade de correção funcional.;咬合をチェックし、機能的矯正の必要性を評価する。;Controllare l'occlusione e valutare la necessità di una correzione funzionale.;Comprobar la oclusión y evaluar la necesidad de corrección funcional.;Überprüfen Sie die Okklusion und beurteilen Sie die Notwendigkeit einer funktionellen Korrektur.;Vérifier l'occlusion and évaluer the besoin d'a correction fonctionnelle.;
ligature;Assurez-vous que les ligatures sont bien serrées pour un contrôle optimal de l'arc orthodontique.;gpt4o;Assurez-vous que les ligatures sont bien serrées pour un contrôle optimal de l'arc orthodontique.;确保系带紧固，以实现对弓丝的最佳控制。;تأكد من أن الأربطة محكمة للتحكم الأمثل في السلك المقوس.;ตรวจสอบให้แน่ใจว่ามีการขันลวดมัดให้แน่นอย่างปลอดภัยเพื่อการควบคุมโครงเหล็กจัดฟันที่เหมาะสมที่สุด;Asigurați-vă că ligaturile sunt strânse pentru un control optim al arcului.;Upewnij się, że ligatury są szczelne, aby zapewnić optymalną kontrolę nad łukiem.;Certifique-se de que as ligaduras estão apertadas para um controlo ótimo do arco.;アーチワイヤーを最適にコントロールするために、リガチャーをしっかりと締めてください。;Assicurarsi che le legature siano ben strette per un controllo ottimale del filo dell'arco.;Asegúrese de que las ligaduras estén bien apretadas para un control óptimo del arco de alambre.;Achten Sie darauf, dass die Ligaturen fest sitzen, um eine optimale Kontrolle des kieferorthopädischen Bogens zu gewährleisten.;Assurez-vous that the ligatures are bien serrées for a control optimal of l'orthodontic arch.;
